position_name,company_name,salary,work_city,work_exp,education,company_size,company_type,industry,position_url,job_summary,welfare,salary_count
算法工程师-FAE-苏州、上海,外企德科数字技术有限公司,1.3万-1.7万,上海,3-5年,本科,10000人以上,合资,人力资源服务,http://www.zhaopin.com/jobdetail/CCL1480117890J40726587205.htm,岗位职责：基于技术认证规范和流程要求，针对生态经理拓展的生态合作伙伴进行相应的技术兼容性认证。1 针对合作伙伴的方案进行认证测试；2 指导合作伙伴进行业务的指令集移植；3 针对生态经理拓展的复杂方案，与支持生态经理与伙伴一起对接方案。基本要求：需要AI经验1 国家统招大学本科及以上学历，计算机、软件、数学等专业毕业生；2 工作经验为软件开发、软件测试或系统集成，IT行业工作经验，云计算相关工作经验...,,13薪
ai软件测试,软通动力信息技术(集团)股份有限公司,1万-1.6万,上海,1-3年,本科,10000人以上,民营,互联网,http://www.zhaopin.com/jobdetail/CC000544460J40655684816.htm,1、专业要求：不限，本科及以上。2、有2年以上产品\项目测试经验，参加过1个AI相关产品或功能的体验测试项目，熟悉产品交付流程。3、熟悉软件测试的基本流程，能独立设计基础的测试用例，协助开发人员进行初步定位。4、了解常见AI手机应用场景，如智能通话、智能写作、智能图像等，熟悉用户在这些场景下的操作流程。5、学习能力强，能主动关注AI领域最新产品动态与技术发展趋势。加分项：1、参加过AI相关培训课程...,,
科创AI大客户销售代表（工信部唯一认定平台）,企知道大数据科技有限公司,1.2万-1.6万,上海,经验不限,本科,1000-9999人,民营,专业技术服务,http://www.zhaopin.com/jobdetail/CCL1464680980J40577310408.htm,【公司简介】企知道科技是一家为政府提供企业动态监测、大数据招商引才、政策分析与匹配、科创生态管理等服务，为企业提供产学研对接、知识产权、产业政策咨询、财务、法律、品牌、融资等服务的科创服务机构。公司在全国设立60多家分子公司，为全国20多个省市的政府部门和30万家企业服务，是国家工信部认定的全国唯一的科创类大数据产业发展示范企业。公司旗下“企知道”大数据科创服务平台，汇集了全国9500万家企业信息...,"提成,大牛带队,六险一金,带薪假期,法定节假日,新人保障,带薪旅游,定期团建",16薪
RFID智能设备销售,深圳市斯科信息技术有限公司,8千-1.3万,上海,1-3年,大专,20-99人,民营,物联网,http://www.zhaopin.com/jobdetail/CC842860770J40709783312.htm,岗位职责：1、负责RFID项目的产品销售、市场拓展和客户管理；2、培育、管理及维护客户关系，构建合作伙伴的长期合作战略计划并落实，促成老客户3、参与举办各类应用推广活动，建立和维护人脉关系，通过陌生拜访客户等方法，获取并分析潜在客户信息，促成新客户成交4、负责制定销售计划和销售预算，努力实现优秀业绩；5、负责与客户的洽谈、跟踪、合同签署及回款工作；6、管理团队，协助下属员工解决销售过程中遇到的难题...,,
ai算法工程师,外企德科数字技术有限公司,1.5万-3万,上海,经验不限,本科,10000人以上,合资,人力资源服务,http://www.zhaopin.com/jobdetail/CCL1480117890J40726813305.htm,[福利待遇]1. 办公地点:华为研究所，参与华为本部核心 项目开发;2. 初中高级岗位均在招，月薪15-35K，薪资根据能力可谈;3. 五险一金全额缴纳、周末双休、带薪年假、2-4个月年终奖、双倍加班费、班车福利、每年1-2次升职调薪机会;4、前半年技术大佬一对一带教。[岗位要求]1. 学信网可查的统招全日本科及以上学历，计算机、软件、通信等相关专业优先;2.热爱编程，基础扎实，熟悉掌握但不限于J...,"五险一金,周末双休,带薪假期,加班补助,免费班车,大牛带队",14薪
ai工程师,北京宜通华瑞科技有限公司,2万-2.8万,上海,3-5年,本科,1000-9999人,民营,运营商/增值服务,http://www.zhaopin.com/jobdetail/CC144563220J40666421603.htm,英文要求：阅读能力强，不需要开口Job Title: Generative AI EngineerJob Description: We are seeking a talented Generative AI Engineer to lead the development of AI applications aimed at enhancing software engineering pr...,,13薪
ai视觉算法工程师,上海盛慧信息技术有限公司,9千-1.5万,上海,1-3年,本科,20人以下,民营,通信/网络设备,http://www.zhaopin.com/jobdetail/CC355296510J40660359016.htm,职位描述：1、可以对单点算法性能做出极致优化，或具备全局视野。 2、负责人工智能算法的研究、开发和优化。 3、根据项目需求，设计和实现高效、可靠的AI模型，并确保其在不同场景下的稳定性和准确性。 4、负责移动终端设备人工智能、大数据挖掘算法和解决方案的研究、设计、验证和交付。 5、对传感器在机械运动、生物识别、情景感知等技术做出算法。 6、负责AI模型的训练、测试和部署工作，优化模型性能，减少资源...,,
线上兼职居家美工PS设计师,泉州市苏亿网络科技有限公司,4千-8千,上海,经验不限,学历不限,20-99人,民营,电子商务,http://www.zhaopin.com/jobdetail/CCL1448715950J40661436711.htm,招线上兼职美工PS设计师 可居家办公接单证件照，精修，人像，P图，婚纱照，LOGO，平面设计，3D建模等等工作内容：可远程办公。负责由上一级客服安排的设计订单。全是专人谈好，客户付款了的，只需按要求要完成就行。 要求：熟练PS\AI等设计软件，能独立完成图片的设计。出稿快，不托稿。责任心强。 工作时间：不限 每天早上8点~凌晨12点都有订单无限制时间上线时间，自有安排。 快速入职，立即可接单。根据...,,
视觉设计,湖南图灵工网络科技有限公司,5千-8千元/月,上海,1-3年,学历不限,20-99人,民营,电子商务,http://www.zhaopin.com/jobdetail/CCL1477221930J40708802405.htm,亲亲您好 欢迎加入图灵工平台，我们有自己独立的设计接单系统 注册的一定要实名制 因为我们系统是 TX 自主的系统注册审核后也是需要实名制先注册一下系统链接http:https://www.58tlg.com/ 注册后 登入电脑！登入电脑！登入电脑！按要求去提交试稿作品，等待审核，审核成功后 会发短信给你注册的电话上 注意短信提醒，接到短信后 登入企业微信派单主管会跟您对接接单明细 注册后把你的注册...,,
Python开发（图像AI方向）,软通动力信息技术(集团)股份有限公司,1.4万-2万,上海,3-5年,本科,10000人以上,民营,互联网,http://www.zhaopin.com/jobdetail/CC000544460J40652712716.htm,岗位描述：这个岗位隶属于芯片业务部门效率提升组。旨在通过自动化工具、系统平台的研发提升芯片研发的效率，工具、平台仅为内部使用，不商用。芯片业务的背景于图像相关，涉及到图像质量及效果调优。我们需要人员具体有机器学习、计算机视觉，物体检测和分类，有模型设计、模型训练和验证等相关经验。,,
AI提示词工程师,上海佳贝教育信息咨询有限公司,1万-1.3万,上海,1-3年,本科,20-99人,其它,培训/辅导服务,http://www.zhaopin.com/jobdetail/CC387912210J40676219408.htm,"岗位职责：1、负责AI模型的训练和优化,确保模型的准确性和稳定性。2、参与数据预处理和特征工程,提高模型的性能和泛化能力。3、跟踪最新的AI技术和算法,将其应用到实际项目中。4、定期评估和报告AI模型的性能,提出改进建议。5、编写技术文档和报告,记录模型训练过程和结果。6、参与AI项目的规划和执行,确保项目按时完成并达到预期目标。任职要求：1、本科及以上学历,计算机科学、电子工程或相关领域。2、至...",,
ai测试开发工程师,中电金信软件有限公司,1.3万-1.6万,上海,3-5年,本科,10000人以上,国企,计算机软件,http://www.zhaopin.com/jobdetail/CC443657520J40658140509.htm,•将加入AI团队，负责调试/验证。 •在测试/发布过程中进行一些自动化。 •进行基于脚本的测试用例开发。 •执行质量和性能测试，并生成验证报告。 •帮助对遇到的问题进行一些基本分析。 •为支持客户生成工程包。,,
AI售前（腾讯外包）,软通动力信息技术(集团)股份有限公司,1.4万-2.5万,上海,5-10年,大专,10000人以上,民营,互联网,http://www.zhaopin.com/jobdetail/CC000544460J40602111316.htm,岗一：新出 紧急招人 11-25K 岗位职责：1.根据产品的成熟度制定不同阶段的运营策略，找到应用场景中AI产品的价值点，推动AI产品健康可持续的营收增长； 2.发现AI产品营收增长中的问题和机会，分析业务场景和产品方案的契合点，推进AI产品商业化进展； 3.主导和推动AI产品的商业化落地； 4.和销售/架构师/产品策划等角色配合，完成AI产品的商业化建设与营收目标。 专业知识要求 1.熟悉AI产...,,
ka大客户销售（科创AI+数字化）,企知道大数据科技有限公司,1.5万-2.5万,上海,3-5年,本科,1000-9999人,民营,专业技术服务,http://www.zhaopin.com/jobdetail/CCL1464680980J40661782308.htm,岗位职责：1、面向大型企业或成长性企业客户，挖掘客户在创新研发和知识产权运营管理方面的需求，销售知识产权全生命周期解决方案，帮助客户从企业战略到业务运营全面落实实现创新驱动，通过帮助客户成功，持续达成的业务指标；2、通过与电话、客户服务、专业咨询、实施服务团队紧密配合，伴随客户成长，追求最佳客户体验，建立长期“双赢”的合作关系，保障合作客户续约目标的超额达成；岗位要求:1、热爱销售工作，进取心、责...,"提成,大牛带队,包住,带薪假期,法定节假日,七险一金,新人保障,带薪旅游,定期团建",14薪
招聘Talent Acquisition （美资机器人研发公司）,上海中智项目外包咨询服务有限公司,1万-1.5万,上海,1-3年,本科,1000-9999人,国企,人力资源服务,http://www.zhaopin.com/jobdetail/CC209328710J40661046016.htm,职位：（Senior）Talent Acquisition Coordinator公司地址：浦东新区未来资产大厦，陆家嘴地铁站作为中国研发团队的招聘支持，有软件开发相关的招聘经验加分，英语可工作交流（日常对接APEC如东南亚等）Brief description of service : We are seeking an organized and detail-oriented recruit...,,
AI大模型算法优化工程师,外企德科数字技术有限公司,2.3万-4.5万,上海,经验不限,本科,10000人以上,合资,人力资源服务,http://www.zhaopin.com/jobdetail/CCL1480117890J40717220405.htm,【岗位职责】1、负责大模型AI框架分布式调度、模型并行、数据并行的设计和调优、开发。2、负责大规模自动并行技术竞争力构建，实现大模型训练、推理的性能和扩展性领先和项目落地；3、参与AI编译优化技术研究、开发，支撑多样化算力。4、参与分布式计算、异构计算、高性能计算等关键技术的分析与开发工作。【岗位要求】 1、 熟悉Linux系统，熟悉C++/C/Python/rust中的一种语言。编码能力突出，具...,,14薪
高级AI应用工程师,上海锐嘉科实业有限公司,1.5万-2万,上海,5-10年,本科,100-299人,民营,人工智能,http://www.zhaopin.com/jobdetail/CC446135220J40708511807.htm,1、负责设计和开发基于LLM大模型的AI应用平台；参与集成应用大模型的软件开发工作，包括需求分析、系统设计、编码实现、自动化测试等等。2、负责AIGC场景的调研和落地，推动AI应用为企业赋能；3、参与项目技术方案的制定，对现有系统进行优化改进，提高系统性能和稳定性。4、协助团队解决项目开发过程中的技术难题，提升团队整体技术能力。参与项目相关技术文档的编写，确保项目可维护性和可持续发展。,,
UED设计师,中银消费金融,2万-3万,上海,3-5年,本科,500-999人,合资,银行,http://www.zhaopin.com/jobdetail/CC317236610J40534861604.htm,岗位职责：1. 负责Web端和移动端的用户体验设计交付2. 制定和遵循设计规范，进行组件设计，确保输出物的风格与产品线保持一致3. 使用原型对产品的可用性进行测试，并参与实际系统体验和现场调研，总结问题，改进用户体验4. 对系统交互的流程和规律进行沉淀总结，迭代升级设计规范任职要求：1. 具备3年及以上工作经验2. 本科及以上学历，视觉设计、多媒体设计、工业设计或相关专业3. 熟练使用Sketch...,,
深度学习异构计算研发工程师 （ AI 推理引擎方向）-PDI,字节跳动,3万-6万,上海,经验不限,本科,10000人以上,民营,互联网,http://www.zhaopin.com/jobdetail/CC469217510J40620331601.htm,岗位职责：1、负责端侧模型推理框架开发，包括模型压缩、优化技术，在端侧的接入、适配、算子开发工作，使之符合业务要求，提高性能收益；2、负责探索和落地 AI 模型工程部署前沿技术，包括但不限于稀疏计算、编译优化。任职要求：1、具备扎实的计算机科学功底和编程能力，了解常见并行计算算法，具有良好的编程习惯；2、熟悉transformers、stable diffusion等主流模型原理；3、良好的团队协...,"五险一金,股票期权,带薪假期,弹性工作",
erp软件销售,深圳市思源计算机软件股份有限公司,1万-2万,上海,3-5年,大专,100-299人,上市公司,IT服务,http://www.zhaopin.com/jobdetail/CC147303860J40212151307.htm,岗位要求：1、3-10年IT行业直销经验；2、善于挖掘商机，维护客户关系，开拓新市场；3、勤奋乐观，学习能力强；4、有ERP、AI 、IOT物联网等销售经验，售前经验者优先考虑；5、计算机、市场营销、会计学、管理学等相关专业统招大专及以上专业优先； 如果你恰好有一些IT直销经验，聪明肯学，人老实，愿意为自己的未来打拼，请直接投递简历，我会尽快联系你此岗位会根据候选人背景及发展方向结合公司销售序列现...,"五险一金,绩效奖金,带薪假期,体检福利,带薪旅游,节日慰问,周末双休",
AI运营工程师,金诃藏药股份有限公司,1万-2万,上海,经验不限,学历不限,500-999人,民营,医药制造,http://www.zhaopin.com/jobdetail/CC000552040J40470559308.htm,"1、利用ChatGPT等先进的人工智能工具，帮助公司各部门提升工作效率；2、热爱研究各类AI软件、利用各种插件解决工作中的各类问题；3、基于工作场景的指导:Al绘画、PSAI、Chat GPT/A I工具部署、Chat GPT使用方法指导4、解决各种与提示词相关的技术难题,并进行系统性能优化和调试",,
线上兼职居家美工PS设计师,泉州市苏亿网络科技有限公司,4千-8千,上海,经验不限,学历不限,20-99人,民营,电子商务,http://www.zhaopin.com/jobdetail/CCL1448715950J40661437411.htm,招线上兼职美工PS设计师 可居家办公接单证件照，精修，人像，P图，婚纱照，LOGO，平面设计，3D建模等等工作内容：可远程办公。负责由上一级客服安排的设计订单。全是专人谈好，客户付款了的，只需按要求要完成就行。 要求：熟练PS\AI等设计软件，能独立完成图片的设计。出稿快，不托稿。责任心强。 工作时间：不限 每天早上8点~凌晨12点都有订单无限制时间上线时间，自有安排。 快速入职，立即可接单。根据...,,
IT负责人（AI方向）,广东嘉豪食品有限公司,2万-3万,上海,10年以上,本科,1000-9999人,,快速消费品,http://www.zhaopin.com/jobdetail/CC504537120J40618086009.htm,"岗位职责:职位描述:1.负责公司数智化转型的战略规划与实施2.制定和推进数智化项目、AI计划及策略3.带领团队完成业务数智化转型的项目落地,包括it系统的规划部署、优化迭代等4.负责部门内部流程的优化完善以及标准化建设5.对团队的人员进行培训和指导,提高团队整体能力水平6.负责部门员工日常管理和绩效考核,并持续推动组织效能提升7.参与公司业务战略发展,协助领导决策支持,提供业务分析数据支持8.承担...",,15薪
AI语音识别模型开发师,人卫嘉奕(上海)医学科技有限公司,1.3万-1.6万,上海,1-3年,本科,20-99人,民营,医疗设备/器械,http://www.zhaopin.com/jobdetail/CC703482320J40593781410.htm,岗位职责：1.负责分布式训练相关性能优化，包括数据加载、计算和显存优化等2.负责研发大模型高效容错技术，保证大模型能够持续训练。3.研究不同集群或者不同硬件配置上的最优并行策略和优化方法以及相关自动化技术。4.设计和开发大模型分布式训练系统，并探索相关前沿技术应用到实际项目中。5.负责对接和制作AI大模型产品的需求和业务改动。6.负责语音识算法的研究与开发，如声学模型训练、语言模型训练、解码器系统...,,
智能化运维产品经理（算法方向）,万国数据服务有限公司,2.5万-3万,上海,3-5年,本科,1000-9999人,上市公司,IT服务,http://www.zhaopin.com/jobdetail/CC136753050J40682517401.htm,岗位职责：1. 需求分析及产品原型设计、交互设计及用户体验提升；2. 深入了解数据中心智能化运维产品市场，搜集行业动态和政策信息；3. 编写产品需求文档、实施方案和市场推广资料；4. 确认并管理软件开发的功能方向；5. 把控产品研发流程，与开发团队协作，保证质量和进度；6. 跟进开发进度，确保功能点效果达成；7. 协调测试团队完成产品测试及BUG修正。职位要求：- 本科及以上学历，计算机、数学、人...,,14薪
人形机器人AI算法工程师,上海冶成国际贸易有限公司,3万-5万,上海,经验不限,硕士,20人以下,民营,人工智能,http://www.zhaopin.com/jobdetail/CC406026510J40547585710.htm,1、精通人形机器人深度学习、计算机视觉、人工智能诊断、图像处理、图像 分类、图像分割、图像识别、目标检测。2、 专攻于机器人味觉方面领域。3、专攻于人形机器人听觉方面领域以上3项满足一项即可,,13薪
AI硬件事业部负责人(J10301),上海祥承通讯技术有限公司,4万-5万,上海,5-10年,本科,1000-9999人,民营,通信/网络设备,http://www.zhaopin.com/jobdetail/CC366977680J40691631001.htm,岗位职责:职位描述（工作职责）1.探索智能硬件与AI相结合的新型业务路径、新型产品规划与方向，并依此制定事业部市场策略，发展战略；2.理解智能硬件与AI结合的产品应用场景，并找到适配的合作伙伴；3.基于市场及客户需求制定并搭建事业部运行体系；4.根据公司全年销售目标制定事业部产品推广及销售计划，完成公司要求的销售目标；5.熟悉公司平台体系，形成良好配合机制，充分整合公司内外部资源，不断发掘客户需求...,,
华为-德科_AI软件开发师,华为技术有限公司,面议,上海,经验不限,本科,10000人以上,民营,运营商/增值服务,http://www.zhaopin.com/jobdetail/CC000542940J40708397614.htm,【岗位描述】华为-AI软件开发工程师华为-德科合作——面向社招，在这里你将从事 IT 应用层软件、分布式AI平台等设计开发，包括但不限于：1、完成从客户需求到软件产品定义、架构设计、开发实现、再到上线运营维护等产品生命周期中的各个环节；2、负责AI系统平台的代码开发及重构，持续优化提升代码质量；3、负责AI模型训练、推理加速与优化、大模型适配等AI相关工作；4、创造性解决产品在实现过程中的技术难题...,"年终奖,周末双休,加班补助",
AI引擎语音测试工程师+周末双休,外企德科人力资源服务安徽有限公司,1万-1.1万,上海,1-3年,本科,100-299人,国企,咨询服务,http://www.zhaopin.com/jobdetail/CC450090720J40683606810.htm,1、具备人工智能行业测试经验或者具备一定的服务端测试经验2、具备一定的python编程经验以及能够掌握一定的C++基础，熟练掌握linux上的操作命令3、工作过程中熟练软件测试流程，有较强的沟通能力，做事需要耐心，认真、负责，遇到问题时可以积极主动的去协调上下游解决问题4、学历要求普通本科及以上,周末双休,
机器学习工程师 －computational　imaging（ 居家办公）联合创始人,上海套肯人工智能科技有限责任公司,150-300/天,上海,无经验,学历不限,20人以下,,人工智能,http://www.zhaopin.com/jobdetail/CCL1478181760J40677563105.htm,职位名称: 机器学习工程师 －computational　imaging（ 居家办公）联合创始人 根据AI发展趋势，AGI　五年内必然会实现，superintelligence 十年内必然实现。我们公司专注于superintelligencｃｅ，目前筹划用agent实现computational　imaging的automatic research。欢迎您成为我们创业团队的核心成员，与我们一同成长...,"股票期权,弹性工作",
上海-运营工程师,软通动力信息技术(集团)股份有限公司,1万-1.4万,上海,1-3年,本科,10000人以上,民营,互联网,http://www.zhaopin.com/jobdetail/CC000544460J40660816716.htm,【职位要求】1、统招本科及以上学历2、掌握用户研究常用调研和分析方法，具有敏锐视角，能够把用户需求及体验转换为产品内部需求，提出改进机会点3、具备超强的逻辑分析能力，合作能力，善于沟通表达，学习能力强，有良好的执行力【岗位职责】1、能够对文本语言进行深入的语言分析，对于泛化语料的设计有相关经验，可以根据不同的语言场景设计合理的语言表达形式和文本结构。3、负责图片语料的设计和制作，根据应用场景和需求...,,
AI解决方案,上海宇量昇科技有限公司,2.5万-3.5万,上海,5-10年,本科,300-499人,,电子/半导体/集成电路,http://www.zhaopin.com/jobdetail/CCL1435759000J40786333015.htm,工作职责1、基于大模型核心能力（包括不限于文本对话（类GPT）、信息搜索（类NewBing）、图文生成（类Diffusion）等）构建专业领域应用，熟悉大模型相关算法开发与落地，负责包括不限于模型预训练、微调、部署以及支持下游应用任务的持续优化等；2、构建服务于大模型应用的知识库技术和工程能力，包括不限于：1）知识图谱：知识建模、知识抽取（复杂知识抽取）、知识推理、图表示学习等2）单/多模态数据合...,,15薪
产品经理 （AI方向）,东方希望集团有限公司,1.8万-3万,上海,10年以上,本科,10000人以上,民营,钢铁/有色金属冶炼及加工,http://www.zhaopin.com/jobdetail/CC000374740J40613550006.htm,"工作职责：1、负责面向AIGC场景的大模型效果与平台的全生命周期的产品规划2、对相关产品开展竞品调研、业务调研、用户调研,输出调研结论设计与推动落地;和相关分析建议;3、与研发、设计等团队深度合作,负责产品方案的落地及功能实现对落地实际效果和用户体验负责;4、参与用户场景研究,对AI落地和应用有思考并有所创新,持续提升产品易用性;5、跟进产品使用效果,梳理并持续完善业务流程,达到降本增效的目的。任...",,15薪
AI渠道管理（腾讯外包）,软通动力信息技术(集团)股份有限公司,1.1万-1.8万,上海,5-10年,本科,10000人以上,民营,互联网,http://www.zhaopin.com/jobdetail/CC000544460J40650481316.htm,负责区域转售的云智能产品运营拓展和代理商管理工作岗位职责：1、负责向代理商重点客户提供售前、售中和售后的业务咨询，包含但不限于需求分析和挖掘、方案设计、方案交流、概念验证、售后服务等，促进客户成交，完成营收目标。2、管理10家以上代理商或者合作伙伴，对合作伙伴的销售、架构师等角色进行培训赋能，帮助合作伙伴基于其能力模型和客户类型，引导拓展方向，协助打单，促进成交，完成营收目标。3、负责新客户的拓展...,,
数据标注员/文员,上海盛慧信息技术有限公司,2千-4千,上海,经验不限,大专,20人以下,民营,通信/网络设备,http://www.zhaopin.com/jobdetail/CC355296510J40660358016.htm,"职位名称：数据标注员工作地点： [上海浦东康桥]招聘人数： 若干工作时间： 8:30-12:00，13:00-17:30薪资结算方式： 按日结算薪资范围： 100-200元/天（根据个人能力和工作完成量而定）1、负责公司提供的数据标注任务，确保标注结果的准确性和及时性。 2、遵循公司标注规范，对标注数据进行质量把控，结合标注需求，总结标注规则和标注方法,并完成标注任务。3、总结标注任务中出现的问题...",,
