position_name,company_name,salary,work_city,work_exp,education,company_size,company_type,industry,position_url,job_summary,welfare,salary_count
AI专员,上海丝闻云书文化传播有限公司,7千-1万,上海,1-3年,本科,20-99人,民营,广播/影视,http://www.zhaopin.com/jobdetail/CC424851530J40662906703.htm,1.岗位要求：人工智能相关专业毕业具有一定课题研究能力2.工作目标2025年让各工作岗位效率提升一倍；3.工作内容：能够定期选择并向不同岗位员工推荐使用最高效的AI工具，并定期培训AI工具的使用方法，并对员工AI使用能力进行测试和评价；能够让AI工具与服务项目深度结合，促进工作速度提高；能够不断拓展AI工具在公司的使用场景；,,
机器学习工程师 －computational　imaging（ 居家办公）联合创始人,上海套肯人工智能科技有限责任公司,2.1万-4万,上海,经验不限,学历不限,20人以下,,人工智能,http://www.zhaopin.com/jobdetail/CCL1478181760J40708142905.htm,职位名称: 机器学习工程师 －computational　imaging（ 居家办公）联合创始人 根据AI发展趋势，AGI　五年内必然会实现，superintelligence 十年内必然实现。我们公司专注于superintelligence，目前筹划用agent实现computational　imaging的automatic research。欢迎您成为我们创业团队的核心成员(联合创始人)，与...,"股票期权,弹性工作",
移动端开发工程师（AI产品）,北京三快在线科技有限公司,面议,上海,1年以下,本科,1000-9999人,上市公司,互联网,http://www.zhaopin.com/jobdetail/CC383625320J40628323709.htm,大众点评作为国内重要的本地生活消费决策参考平台，多年来深耕本地生活消费领域，深受广大用户的信任和喜爱。我们的业务覆盖了吃喝玩乐游购娱等生活场景，通过极具辨识度和公信力的”星级“和”评价“产品，为数亿用户提供了全面、可信的消费决策依据。为更好满足用户探索城市的需求，大众点评在原有星级和评价的基础上，以信息流产品形式，助力用户发现更多好去处。大量优秀年轻同学的加入，为我们的团队注入了澎湃活力。我们相信...,弹性工作,
软件工程师（前端/后端/AI/测试、接受断档，语言不限）全国多地有岗,外企德科数字技术有限公司,1.5万-3万,上海,经验不限,本科,10000人以上,合资,人力资源服务,http://www.zhaopin.com/jobdetail/CCL1480117890J40721956905.htm,【学历要求】：统招4年制本科，学信网可查，毕业证学位证都在，经验越丰富越好，初中高级开发工程师均有需求【任职要求】1、计算机、软件、通信等相关专业本科及以上学历；。2、热爱编程，基础扎实，熟悉掌握但不限于JAVA/C++/C/JS/Android等编程语言中的一种或数种，有良好的编程习惯；3、具备独立工作能力和解决问题的能力、善于沟通，乐于合作，热衷新技术，善于总结分享，喜欢动手实践； 1、薪资范...,"加班补助,五险一金,免费班车",14薪
AI influener（居家办公）实习生联合创始人-- fitness知识方向,上海套肯人工智能科技有限责任公司,150-250/天,上海,无经验,本科,20人以下,,人工智能,http://www.zhaopin.com/jobdetail/CCL1478181760J40694093405.htm,职位招募：AI influener（居家办公）联合创始人--fitness知识方向根据AI发展趋势，AGI　五年内必然会实现，superintelligence 十年内必然实现。我们公司专注于superintelligenct，目前筹划用agent实现视频的自动编辑。欢迎您成为我们创业团队的核心成员，与我们一同成长，实现财务自由！我们提供： 丰厚的股份激励：加入我们一年后，您将获得价值1000万的...,"股票期权,弹性工作",
AI报告板块销售（B端）,铂睿德佳,1.1万-2.2万,上海,1-3年,学历不限,100-299人,民营,咨询服务,http://www.zhaopin.com/jobdetail/CC535170420J40642244402.htm,岗位职责：负责公司AI报告板块销售工作、拓展客户任职要求：1、30周岁以内，不限院校及专业；2、有过账号销售或者数据库销售的经验，或自动化、机器人行业，做过产品销售或渠道拓展；3、寻求长期发展的工作机会，之前工作连续时间不少于1年且工作更换频率少于5年内3次。,,
AI大模型专家,苏州人瑞普惠人力资源服务有限公司,3.5万-7万,上海,3-5年,本科,500-999人,上市公司,互联网,http://www.zhaopin.com/jobdetail/CC427775130J40788340515.htm,岗位职责：1、负责人工智能领域前沿算法的研发、探索人工智能的创新应用；2、负责大模型工具链平台研发，支持大模型数据清洗、训练、编译量化、推理、评估等功能；3、负责NLP/CV/跨模态基础大模型研发，行业大模型知识注入、精调、推理等研发工作；4、负责大模型训练、推理加速技术研究，解决千亿级大模型训练及推理加速关键技术问题；5、负责CV领域目标检测、图像定位、语义分割、多目标跟踪等算法研发。任职要求：...,,
AI产品经理,天翼数字生活科技有限公司,1.5万-3万,上海,3-5年,本科,1000-9999人,国企,计算机软件,http://www.zhaopin.com/jobdetail/CCL1350743460J40616782407.htm,岗位职责：1、负责公司AI中台业务架构设计、平台建设； 2、负责公司各产品AI能力需求收集、需求分析、需求设计； 3、负责外部AI能力能力映入，能力封装，能力产品化； 4、对标行业竞品，持续迭代优化AI中台及相关AI能力； 5、对产品进行效果跟踪，数据分析，用户分析，以及及时反馈到产品迭代中。 任职要求：1、有2年以上AI 从业经验，熟悉各类AI技术、AI模型； 2、了解 AI算法，机器学习，自然...,,
AI数据服务平台运营-运营方向,字节跳动,1.5万-3万,上海,5-10年,本科,10000人以上,民营,互联网,http://www.zhaopin.com/jobdetail/CC469217510J40669457601.htm,岗位职责：1、负责字节跳动AI数据服务团队工作平台的日常运营与支持工作，特别是为使用相关平台的海内外用户提供技术支持服务；2、深入理解业务逻辑和流程，用户痛点及相应需求，负责目标用户调研、用户反馈收集，并输出产品优化建议及方案；建立规范的需求调研、反馈机制，并确保完善的信息透传链路；3、监控业务数据指标，透过数据发现并定位业务存在的障碍，并搜集与平台相关的问题和反馈，以通过平台的优化和迭代持续推动...,,
AI GPT技术架构师全栈Technical Architect,上海安进投资管理有限公司,2.3万-3万,上海,3-5年,本科,20人以下,民营,咨询服务,http://www.zhaopin.com/jobdetail/CC595193520J40580317209.htm,5 年大规模深度学习应用，拥有 TB 级的训练数据职位描述：必须具有至少 6 年的技术架构师经验至少有 1 年生成式人工智能和学士学位模型的经验，例如 GPT4、GPT3.5、Palm 系列模型、Llama2、Falcon、Anthropic。必须知道如何进行 LLM 指令调整，例如 llam2 等。必须了解 Python，并且应该是 Python 专家。必须具备必须具有预训练模型（小型和大型）的...,,
销售专员【AI人工智能产品-知名上市公司】,科锐尔人力资源服务(苏州)有限公司,8千-1.5万,上海,无经验,大专,1000-9999人,上市公司,咨询服务,http://www.zhaopin.com/jobdetail/CC453635220J40714025503.htm,"岗位职责：1.工作内容入职培训以后按照公司规定完成工作内容，完成相对应的工作任务，需要通过电话，邮件，QQ，微信等各种方式开发客户，成交客户。2.销售产品互联网SaaS产品，只能营销工具。3.销售对象主要针对企业做互联网营销，我司提供相对应的服务任职要求：1．年龄18-25周岁，性别不限；2．本科及以上学历,有无相关经验均可，优秀应届毕业生亦可；3．热爱销售、热爱互联网行业，有目标、有热情，想挑战...",,
AI行业重客总监,福建博士通信息股份有限公司,2万-3.5万,上海,5-10年,本科,100-299人,民营,运营商/增值服务,http://www.zhaopin.com/jobdetail/CC181240110J40528210208.htm,岗位职责：1. 负责公司智能AI语音机器人及解决方案的销售，对业绩考核目标达成负责；2. 负责销售中涉及的商机挖掘，产品推介，需求沟通分析、商务谈判，项目跟踪等服务等工作；3. 收集行业内主要竞争对手的产品、方案等相关信息；收集市场一线信息，为产品优化迭代提供参考性意见。任职要求：1. 有头部数据公司、持牌金融、保险、基金、证券、品牌电商等客户资源的销售经验；不符合条件者勿扰；2. 本科及以上学历...,,13薪
给总经理开车，退伍优先，大专本科,上海太屋网络科技有限公司,7千-1.4万,上海,经验不限,本科,1000-9999人,民营,房地产开发,http://www.zhaopin.com/jobdetail/CC294547880J40211994303.htm,大专学历：7000元底薪+高额提成本科学历：8000元底薪+高额提成士官退伍：8000元底薪+高额提成士兵退伍：6000元底薪+高额提成（党员8000元）保底18个月，无责任底薪！租赁提成35%，买卖提成高45%,"提成,无责底薪,五险一金,绩效奖金,有房补,试用期全薪,带薪假期,弹性工作,带薪旅游,节日慰问",
AI大模型课程顾问【无责6k+双休】,广州欢创信息咨询有限公司,1.1万-2万,上海,无经验,大专,100-299人,民营,人力资源服务,http://www.zhaopin.com/jobdetail/CC531289680J40660907709.htm,岗位优势：上海近屿智能科技有限公司成立于2019年，处于人工智能这一朝阳行业，在中国AI应用领域中处于领先地位。是一家以AIGC和RPA技术为核心的人力资源领域的产品和解决方案公司。近屿智能的核心产品之一是AI得贤招聘官，她是中国第一款基于AIGC和虚拟人技术的人才管理系统。在大环境融资艰难的情况下，近屿智能于2024年1月完成A轮融资，近屿智能的另一款核心产品是AIGC大模型培训项目，学员可以基...,"五险一金,周末双休,无责底薪,提成,法定节假日",
AI influener（居家办公）实习生联合创始人-- AI 知识方向,上海套肯人工智能科技有限责任公司,150-250/天,上海,无经验,本科,20人以下,,人工智能,http://www.zhaopin.com/jobdetail/CCL1478181760J40694093205.htm,职位招募：AI influener（居家办公）联合创始人-- AI知识方向根据AI发展趋势，AGI　五年内必然会实现，superintelligence 十年内必然实现。我们公司专注于superintelligenct，目前筹划用agent实现视频的自动编辑。欢迎您成为我们创业团队的核心成员，与我们一同成长，实现财务自由！我们提供： 丰厚的股份激励：加入我们一年后，您将获得价值1000万的公司预期...,"股票期权,弹性工作",
AI训练师,上海从鲸信息技术有限公司,1.2万-2.4万,上海,经验不限,本科,10000人以上,民营,互联网,http://www.zhaopin.com/jobdetail/CCL1482748030J40690410412.htm,岗位职责1、通过高质量的语言注释，提高Al客服机器人用户意图识别的准确性，为人工智能模型的训练提供依据；2、识别客户与机器人交互中存在的问题分析相关数据，定期生成的聊天机器人能力报告，不断提高算法模型的准确性、客户满意度和聊天机器人的服务水平；3、与相关职能团队合作，负责标注需求谈判、标准创建和项目的综合工作流程，制定BPO标注考核流程与规范，提升标注效率和准确率，改进标注工具和流程；4、负责知识...,,16薪
市场销售专员,上海智无界人工智能科技有限公司,1.5万-3万,上海,5-10年,大专,20-99人,股份制企业,人工智能,http://www.zhaopin.com/jobdetail/CCL1483997170J40549778913.htm,上海智无界人工智能科技有限公司专注于Web3.0和人工智能领域，致力于通过创新技术为企业提供智能化解决方案。我们的主要产品包括：1. **Web3.0+AI人工智能培训** - 与上海交通大学合作，提供先进的培训课程。2. **人工智能精训工具** - 帮助企业提效降本，扩展产品边界，提升服务品质。3. **Web3+AI技术开发** - 赋能实体经济，重塑企业商业架构，实现营销一体化。**销售人...,,
AI解决方案,中软国际,面议,上海,5-10年,本科,10000人以上,上市公司,计算机软件,http://www.zhaopin.com/jobdetail/CC508620120J40661869512.htm,岗位职责：1.与销售团队紧密合作，了解客户需求并提供专业的售前支持。2.负责政务、大企业、工业制造等行业方向的机器视觉类、预测分析类应用场景开发等的售前技术支持，能主导整体可行性方案、项目立项方案等;3.为客户提供产品演示、方案讲解和技术咨询，解答客户疑问，负责收集和分析市场信息，为公司的产品和服务提供改进建议。4.能够主导进行项目前期线商机收集、分析客户需求，负责制定和维护售前文档开发，包括方案...,,
（VR高科技看房）销售代表+房产经纪人+储备干部Mmm,上海链家房地产经纪有限公司,8千-1.6万,上海,经验不限,本科,10000人以上,民营,房地产中介,http://www.zhaopin.com/jobdetail/CC307313210J40271334001.htm,链家致力于打造高学历、高专业度、高职业素养和高社区参与度的4.0经纪人队伍，以推动经纪人的职业化发展为核心。2019年12月16日，上海链家率先实现了51%统招本科率，我们希望改造行业的人才供应链，用新时代的统招本科生来锻造更品质的链家。在人才培养方面，我们也为经纪人建立了包括新人三十天脱岗培养体系、职级衔接训、在岗培训和大区训在内的专业化培训机制，并通过专业知识考试“搏学大考”等方式，帮助经纪人...,"大牛带队,五险一金,带薪假期,体检福利,带薪旅游,节日慰问,法定工作时间",
AI训练师（招聘方向）,外企德科,9千-1.5万,上海,1-3年,本科,1000-9999人,合资,人力资源服务,http://www.zhaopin.com/jobdetail/CC138117190J40725990205.htm,主要职责：1、【数据分析】以日、周、月为单位，对数据进行汇总分析，核查数据异常原因。2、【需求收集】负责与外部公司进行对接，收集其反馈的需求，并进行初步分析评估，同时与业务及产品完成需求对接，跟进需求进展，并将进展及时同步给对接人。3、【产品迭代】负责C端产品及内部系统的迭代优化，通过收集用户需求及分析运营数据，确定产品系统的功能优化点，推动产研团队落地。4、【用户行为分析】负责相关的数据分析工作...,,14薪
AI设计师,上海刀弓广告会展有限公司,8千-1万,上海,1-3年,学历不限,20-99人,,会议/展览,http://www.zhaopin.com/jobdetail/CCL1396323370J40701229703.htm,教育背景和经验要求：学历没有特别要求，需要具备2年以上的AI设计或相关领域的工作经验，有美术基础者优先考虑。技能要求：1.软件掌握：需要熟练掌握AI、PS/CorelDRAW等相关设计程序和软件1。编程语言：熟练运用至少一种编程语言，如Python、Java、C++等3。2.设计能力：具备良好的创意构思和色彩感，能够进行跳跃的思维和完美的色彩搭配。3.数据分析：具备一定的数据分析能力，能够根据分析...,,13薪
销售VP（云算力/云计算/ai芯片）上海/北京/深圳,勤达科技,3万-6万,上海,5-10年,本科,100-299人,民营,咨询服务,http://www.zhaopin.com/jobdetail/CC345252110J40860278704.htm,1. 可以迅速熟悉行业，设计业务框架及有效的管理流程2. 具有很强的业务敏感度，能够捕捉客户根本需求，传递公司价值3. 拥有卓越的团队带领及项目牵引能力，调动公司整体资源达成销售目标4. 善于分析现有业务布局，通过市场和销售端的捕捉，协助技术团队定位产品的定义及迭代，并有效为下一代产品的销售在客户端铺垫任职要求：1. 初创公司商业类职位一号位的经验2. 有可以量化的销售指标达成3. 工作稳定，有韧...,,15薪
招聘AI Sourcing,外企德科,9千-1.3万,上海,1-3年,本科,1000-9999人,合资,人力资源服务,http://www.zhaopin.com/jobdetail/CC138117190J40725962105.htm,岗位内容：1.与it团队、招聘团队一起梳理AI Sourcing的流程和标准，针对目前遇到的问题进行项目完善，最终实现内部提效2. 与业务部门紧密合作，理解各个职位的技能需求并寻找合适的候选人3. 分析招聘数据，探索新的招聘渠道和方式4. 建立和维护候选人的数据库并进行有效的跟进工作任职要求：1. 本科及以上学历，人力资源管理、市场营销等相关专业优先考虑2. 至少2年以上招聘工作经验，有成功的招聘...,,14薪
AI应用开发工程师,欣和企业,1.8万-3万,上海,3-5年,本科,1000-9999人,外商独资,快速消费品,http://www.zhaopin.com/jobdetail/CC268650920J40697791910.htm,岗位职责：1、负责设计和开发基于LLM大模型的AI应用平台；2、负责知识库RAG的部署和调优，结合企业内部知识，搭建企业知识库问答平台；3、有丰富的提示词和Agent流程编排经验；4、负责公司AIGC场景的调研和落地，推动AI应用为企业赋能。任职资格：1、本科及以上学历，3-5年相关工作经验，30岁以下优先；2、熟悉市面上主流文本、多模型模型的特性，可以根据场景和需求，选择不同的模型进行使用；3、...,,
AI语言模型开发,上海谷赢信息科技有限公司,1.1万-2万,上海,3-5年,本科,20-99人,民营,IT服务,http://www.zhaopin.com/jobdetail/CCL1226041120J40666900109.htm,岗位职责：1.参与设计大语言模型应用的技术方案并在交易系统中落地。具型场景包括但不限于多轮对话，DBGPT、结构化信息抽取、私有函数调用、AI Agent等；2.负责大语言模型应用的端到端研发，包括但不限于方案设计、数据准备及处理，行业模型训练、指令精调、模型效果测评等；3.跟踪并分析业内最新研究成果和技术动态，复现相关公开研究成果。持续优化和改进相关技术方案任职要求：1.计算机相关专业本科及以上...,,
科大讯飞AI语音测试+朝九晚六双休五险一金,外企德科人力资源服务安徽有限公司,9千-1.1万,上海,经验不限,本科,100-299人,国企,咨询服务,http://www.zhaopin.com/jobdetail/CC450090720J40680693910.htm,"职位职责1.主要从事AI引擎产品测试工作，主要涉及的是语音相关的的AI引擎产品； 2.根据要求执行测试，对测试结果进行分析，编写测试报告并提交上线；3.对线上问题和缺陷进行分析定位，对核心效果进行评估分析；4.在指导下完成必要的测试工具开发、用例设计工作""任职要求1、具备人工智能行业测试经验或者具备一定的服务端测试经验2、具备一定的python编程经验以及能够掌握一定的C++基础，熟练掌握linu...","周末双休,五险一金,法定工作时间",
ai开发,沈阳思诺科技有限公司,1.9万-2万,上海,5-10年,本科,100-299人,民营,计算机软件,http://www.zhaopin.com/jobdetail/CC257043280J40666200703.htm,"1.参与设计大语言模型应用的技术方案并在交易系统中落地。典型场景包括但不限于多轮对话、DBGPT、结构化信息抽取、私有函数调用、AI Agent等:2.负责大语言模型应用的端到端研发，包括但不限于方案设计、数据准备及处理、行业模型训练、指令精调、模型性能提升、模型效果评测等:3.跟踪并分析业内最新研究成果和技术动态,复现相关公开研究成果。持续优化和改进相关技术方案.任职要求1.计算机相关专业本科及...",,
AI大模型工程师,上海慧铂信息技术有限公司,1.5万-2万,上海,无经验,本科,300-499人,民营,IT服务,http://www.zhaopin.com/jobdetail/CCL1473614780J40630874114.htm,岗位职责负责AI大模型的评测与分析工作，与模型训练团队配合不断优化提升AI大模型效果。具体工作内容包括但不限于：1. 深入理解大规模预训练语言模型，参与模型评测方案的制定与评测数据集的建设。2. 通过对模型进行全方面细致的评测，明确模型能力边界，对模型能力进行深入分析，产出围绕大模型的客观认知，从而为模型训练迭代提供指导意见。3. 追踪大模型方向前沿进展，积极主动地学习和探索新的评测及分析的方法和...,,
人工智能助理工程,上海珑付云起企业发展有限公司,8千-1.2万,上海,经验不限,大专,20-99人,,企业服务,http://www.zhaopin.com/jobdetail/CCL1488223950J40753039315.htm,职位要求:1、计算机、大数据、通信、物联网、人工智能等相关专业，大专及以上学历2、了解人工智能行业，对AI相关领域关注，重要的是稳定踏实3、良好的数据分析和沟通能力，协助各类需求调研、技术方案的编写和需求原型图设计;4、逻辑思维清晰，富有创新精神，对AI领域感兴趣，愿意在AI领域积极探索;没有相关经验的需要从部门助理做起,,
AI芯片MMU架构师/设计工程师,芯至科技(上海)有限公司,3万-6万,上海,3-5年,硕士,20-99人,民营,电子/半导体/集成电路,http://www.zhaopin.com/jobdetail/CCL1450092160J40691253512.htm,岗位职责： 1. 参与AI芯片软硬件功能划分、内核/SoC微架构功能制定、SoC硬件功能集成等工作；2. 负责AI芯片MMU功能、硬件微架构、关键技术指标（包括TLB Capacity、TLB Address Mapping、集中式或多级TLB结构、Page Size、Page Table Walk、单级或多级页表映射机制、虚实地址空间定义、Page Miss/Hit处理机制、与IO总线地址空间交...,,
AI产品经理,上海东浩人力资源有限公司,2.5万-4万,上海,3-5年,本科,100-299人,国企,咨询服务,http://www.zhaopin.com/jobdetail/CC382087910J40648178607.htm,职责描述：1、 负责数字化产品整体管理，面向B端用户的技术平台产品的需求分析、产品定义、交互设计等，包括产品用户需求调研、制定产品计划、撰写功能需求文档、设计产品原型图和流程图，以及负责项目的执行和效果评估以及后续改进工作；2、 定期关注业界动态和客户对于产品各项功能的反馈，能提出建设性的创新项目提案，不断提高产品用户体验和运营的效率；3、 了解toB SaaS产品的用户需求调研方法，研究同行业竞...,,
AI influener（居家办公）实习生联合创始人-- digital service方向,上海套肯人工智能科技有限责任公司,150-250/天,上海,无经验,本科,20人以下,,人工智能,http://www.zhaopin.com/jobdetail/CCL1478181760J40694093305.htm,职位招募：AI influener（居家办公）联合创始人-- digital service方向根据AI发展趋势，AGI　五年内必然会实现，superintelligence 十年内必然实现。我们公司专注于superintelligenct，目前筹划用agent实现视频的自动编辑。欢迎您成为我们创业团队的核心成员，与我们一同成长，实现财务自由！我们提供： 丰厚的股份激励：加入我们一年后，您将获得价...,"股票期权,弹性工作",
高级销售精英【AI行业Top+储干+当月发薪】,探迹科技,1万-1.5万,上海,1-3年,大专,1000-9999人,民营,互联网,http://www.zhaopin.com/jobdetail/CC406882580J40680184402.htm,【公司背景】销售SaaS领域头部企业，产品研发实力领先行业，全球顶尖资方红衫、启明、软银、阿里、凯辉基金、GGV纪源资本等资方领投，连续五年保持营收高增长，连续四年荣获“全球独角兽企业”称号，团队分布遍及全国近40个城市。【岗位介绍】1、作为团队的核心销售岗位，负责重点/优势行业客户的开拓和成交，售卖能够帮助企业提升销售全流程效率的智能销售SaaS软件（探迹拓客、探迹触达等）；2、通过公司的海量数...,"提成,股票期权",
ai产品经理,上海威润信息科技有限公司,1.8万-2.1万,上海,3-5年,本科,20-99人,民营,计算机软件,http://www.zhaopin.com/jobdetail/CC208788930J40862095804.htm,我们正在寻找一位经验丰富的AI产品经理，负责从需求分析到产品上线的全流程管理。工作内容：1. 负责AI产品的需求分析、规划、设计及实施；2. 与技术团队合作，完成产品开发并上线；3. 对产品进行持续优化，提升用户体验；4. 分析市场趋势，调整产品策略。岗位要求：1. 本科及以上学历，3年以上AI产品经理工作经验；2. 熟练掌握PRD、Axure、MindManager等产品经理常用工具；3. 对A...,,
