position_name,company_name,salary,work_city,work_exp,education,company_size,company_type,industry,position_url,job_summary,welfare,salary_count
2025届-硕士-AI开发人员-数据科学-上海,康龙化成,1.5万-2万,上海,无经验,硕士,10000人以上,上市公司,医药制造,http://www.zhaopin.com/jobdetail/CC120543470J40768958515.htm,PRINCIPAL ACCOUNTABILITIES 工作内容：①. 用数据挖掘、机器学习等技术手段探索挖掘并打造新药研发中的AI应用②. 参与方案设想、调研、设计、实施全流程研发工作③. 参与数据采集、清洗、增强、分析挖掘、建模工作JOB REQUIREMENTS 我们希望你具备：①. 数学，统计学，人工智能、计算机等专业硕士学历；②. 具备扎实的专业基础，对统计、数据挖掘领域有深度了解和实操能...,,
AI influener（居家办公）联合创始人--金融方向,上海套肯人工智能科技有限责任公司,2.2万-4万,上海,经验不限,本科,20人以下,,人工智能,http://www.zhaopin.com/jobdetail/CCL1478181760J40710533505.htm,职位招募：AI influener（居家办公）联合创始人--金融方向根据AI发展趋势，AGI　五年内必然会实现，superintelligence 十年内必然实现。我们公司专注于superintelligenct，目前筹划用agent实现视频的自动编辑。欢迎您成为我们创业团队的核心成员，与我们一同成长，实现财务自由！我们提供：丰厚的股份激励：加入我们一年后，您将获得价值1000万的公司预期股份。此...,"股票期权,弹性工作",
ppt设计师-线上兼职,四川恒必拓传媒有限公司,500-1000元/周,上海,1-3年,学历不限,20-99人,民营,电子商务,http://www.zhaopin.com/jobdetail/CCL1281388220J40667839912.htm,岗位职责1、 根据需求，设计PPT包括整体布局，美化编辑、动态效果处理等 确保最终效果符合要求；2、结合需求主题设计不同风格、符合主题调性的PPT作品；3、 负责项目文案方面的创作、提炼以及创意构思；4、负责PPT内容策划及排版；get技能：1、PPT设计美化；2、PS，dw，PR，ae，ai、keynote等软件的运用；3、平面设计或美工基础。周结、时间地点自由,工资周结,
2025届 -博士-AI研究员-上海,康龙化成,3万-4.5万,上海,经验不限,博士,10000人以上,上市公司,医药制造,http://www.zhaopin.com/jobdetail/CC120543470J40768879415.htm,岗位职责：在整个新药开发生命周期中开发 AI 应用，包括但不限于药物发现、临床试验和药物监测。利用机器学习技术和大型语言模型，分析提取生物医学和临床数据的见解。与跨职能团队合作，设计和实施增强药物开发流程的 AI解决方案。了解与制药行业相关的机器学习和 AI技术的最新进展。发现，挖掘和实现在药研产业链上 AI 赋能环节和解决方案。为组织的 Al 战略的发展和实施做出贡献。 任职要求:计算机科学、机...,,
AI influener（居家办公）联合创始人-- AI 知识方向,上海套肯人工智能科技有限责任公司,2.2万-4万,上海,1-3年,本科,20人以下,,人工智能,http://www.zhaopin.com/jobdetail/CCL1478181760J40710534705.htm,职位招募：AI influener（居家办公）联合创始人-- AI 知识方向根据AI发展趋势，AGI　五年内必然会实现，superintelligence 十年内必然实现。我们公司专注于superintelligenct，目前筹划用agent实现视频的自动编辑。欢迎您成为我们创业团队的核心成员，与我们一同成长，实现财务自由！我们提供：丰厚的股份激励：加入我们一年后，您将获得价值1000万的公司预期...,"股票期权,弹性工作",
word排版-线上兼职,四川恒必拓传媒有限公司,500-1000元/周,上海,1-3年,大专,20-99人,民营,电子商务,http://www.zhaopin.com/jobdetail/CCL1281388220J40696398112.htm,职位描述：根据客户要求来对文案排版，此岗位不需要坐班，工作时间自由。无需缴纳任何费用 。 主要类型：文档排版设计、书籍排版、图书排版、图文/图册排版、平面排版 任职要求：1.年龄22岁及以上，需要有相关文案排版经验。2.有耐心，有责任心，不拖稿，能接受他人提出的合理修改意见。3.不能失联，时间充裕，能及时回复客户消息。沟通理解能力强。4. 根据时效和要求难度等不同定价，多劳多得，周结。,工资周结,
2025届-硕士-AI开发人员-大模型机器学习-上海,康龙化成,1.5万-2万,上海,经验不限,硕士,10000人以上,上市公司,医药制造,http://www.zhaopin.com/jobdetail/CC120543470J40768927215.htm,1、 PRINCIPAL ACCOUNTABILITIES工作内容负责机器学习、深度学习、大模型相关项目，探索和挖掘AI在新药开发场景及项目中的解决方案；负责具体项目（AI+医药）数据分析、算法/模型方案设计和流程逻辑的调研和研发；参与具体解决方案的数据分析、算法编写等工作；参与模型架构设计、训练、微调等工作；参与项目落地过程中，根据实际情况，对方案可行性、潜在风险的评估和预判； 2、 JOB R...,,
AI influener（居家办公）联合创始人-- AI 知识方向,上海套肯人工智能科技有限责任公司,4千-8千,上海,经验不限,本科,20人以下,,人工智能,http://www.zhaopin.com/jobdetail/CCL1478181760J40694093605.htm,职位招募：AI influener（居家办公）联合创始人-- AI 知识方向根据AI发展趋势，AGI　五年内必然会实现，superintelligence 十年内必然实现。我们公司专注于superintelligenct，目前筹划用agent实现视频的自动编辑。欢迎您成为我们创业团队的核心成员，与我们一同成长，实现财务自由！我们提供： 丰厚的股份激励：加入我们一年后，您将获得价值1000万的公司预...,"股票期权,弹性工作",
PPT设计师【可居家办公】,郑州郑东新区芙力米文化艺术交流有限公司,6千-1万,上海,经验不限,大专,100-299人,,电子商务,http://www.zhaopin.com/jobdetail/CCL1445586370J40686788102.htm,"我司在电商平台有自己的设计店铺，工作便利，多渠道订单，不用担心订单问题，主要做PPT、简历等，需要大量设计师。公司与各位设计人员双方本着友好合作、平等互利的原则,您做单，我给单，您定稿，我结算，互惠互利，做的越多给予的单量与金额均会优质化。1、可接受应届毕业生2、有良好的服务意识3、有耐心，可以和客户良好的沟通并设计出成稿。 经常联系不上的勿扰 玻璃心的勿扰 和客户沟通一点困难就退缩的勿扰 非诚勿...",,
2025届-硕士-AI开发人员-算法工程师-上海,康龙化成,1.5万-2万,上海,经验不限,硕士,10000人以上,上市公司,医药制造,http://www.zhaopin.com/jobdetail/CC120543470J40768959515.htm,1、 PRINCIPAL ACCOUNTABILITIES主要工作内容 负责支持开发和使用人工智能（AI）大模型和深度学习算法，结合计算生物学、结构生物学、化学信息学等技术应用于大分子/小分子药物研发相关环节；围绕业务需求，支持并构建大分子/小分子垂直领域模型化平台；使用state of art生物信息和结构生物学工具进行蛋白质序列比对、同源建模、结构预测、功能分析、结构比对等工作；使用分子动力学...,,
word美化排版-线上兼职,四川恒必拓传媒有限公司,500-1000元/周,上海,1-3年,大专,20-99人,民营,电子商务,http://www.zhaopin.com/jobdetail/CCL1281388220J40692318012.htm,职位描述：根据客户要求来对文案排版，此岗位不需要坐班，工作时间自由。无需缴纳任何费用 。主要类型：文档排版设计、书籍排版、图书排版、图文/图册排版、平面排版任职要求：1.年龄22岁及以上，需要有相关文案排版经验。2.有耐心，有责任心，不拖稿，能接受他人提出的合理修改意见。3.不能失联，时间充裕，能及时回复客户消息。沟通理解能力强。4. 根据时效和要求难度等不同定价，多劳多得，周结。,工资周结,
AI influener（居家办公）联合创始人--金融方向,上海套肯人工智能科技有限责任公司,1万-2万,上海,经验不限,本科,20人以下,,人工智能,http://www.zhaopin.com/jobdetail/CCL1478181760J40694093705.htm,职位招募：AI influener（居家办公）联合创始人--金融方向根据AI发展趋势，AGI　五年内必然会实现，superintelligence 十年内必然实现。我们公司专注于superintelligenct，目前筹划用agent实现视频的自动编辑。欢迎您成为我们创业团队的核心成员，与我们一同成长，实现财务自由！我们提供： 丰厚的股份激励：加入我们一年后，您将获得价值1000万的公司预期股份。...,"股票期权,弹性工作",
销售储备经理（科创+AI赛道）,企知道大数据科技有限公司,2.6万-3.5万,上海,5-10年,本科,1000-9999人,民营,专业技术服务,http://www.zhaopin.com/jobdetail/CCL1464680980J40577332308.htm,【公司介绍】：我们是谁企知道成立于2013年，至今10年全国设有60多家分子公司，服务覆盖北京、上海、广州、深圳、重庆、杭州、成都、苏州、武汉、西安等主要经济城市，公司规模5000+人；企知道是中国科创企业全要素资源服务商、中国科创服务大数据基础设施，通过企业创新要素匹配“大数据+大模型”，提供集成化、智能化、一站式的解决方案；公司愿景：作为技术&大数据驱动科技型定位企业，提升全天下企业的核心竞争...,,
线上兼职居家美工PS设计师,泉州市苏亿网络科技有限公司,4千-8千,上海,经验不限,学历不限,20-99人,民营,电子商务,http://www.zhaopin.com/jobdetail/CCL1448715950J40661437511.htm,招线上兼职美工PS设计师 可居家办公接单证件照，精修，人像，P图，婚纱照，LOGO，平面设计，3D建模等等工作内容：可远程办公。负责由上一级客服安排的设计订单。全是专人谈好，客户付款了的，只需按要求要完成就行。 要求：熟练PS\AI等设计软件，能独立完成图片的设计。出稿快，不托稿。责任心强。 工作时间：不限 每天早上8点~凌晨12点都有订单无限制时间上线时间，自有安排。 快速入职，立即可接单。根据...,,
PPT设计师【可居家办公】,郑州郑东新区芙力米文化艺术交流有限公司,6千-1万,上海,经验不限,大专,100-299人,,电子商务,http://www.zhaopin.com/jobdetail/CCL1445586370J40686788502.htm,"我司在电商平台有自己的设计店铺，工作便利，多渠道订单，不用担心订单问题，主要做PPT、简历等，需要大量设计师。公司与各位设计人员双方本着友好合作、平等互利的原则,您做单，我给单，您定稿，我结算，互惠互利，做的越多给予的单量与金额均会优质化。1、可接受应届毕业生2、有良好的服务意识3、有耐心，可以和客户良好的沟通并设计出成稿。 经常联系不上的勿扰 玻璃心的勿扰 和客户沟通一点困难就退缩的勿扰 非诚勿...",,
AI产品SEO负责人,上海克而瑞信息技术有限公司,2.5万-3万,上海,3-5年,本科,1000-9999人,外商独资,互联网,http://www.zhaopin.com/jobdetail/CC867077430J40725876505.htm,岗位要求：1.SEO策略制定与执行：根据公司AI产品的市场定位，制定整体SEO优化策略和计划。监控并分析SEO效果，持续优化网站结构、内容和关键词布局。 2.关键词研究与分析：进行市场和竞争对手分析，挖掘高价值关键词。定期更新关键词库，优化内容以提升搜索引擎排名。 3.内容优化与管理：协助内容团队创作符合SEO标准的高质量内容。优化现有网站内容，确保内容的原创性、相关性和可读性。 4.技术SEO：...,,
AI视觉软件销售,钰门国际贸易(上海)有限公司,7千-1.2万,上海,1-3年,大专,20-99人,外商独资,电气机械/电力设备,http://www.zhaopin.com/jobdetail/CC137532490J40630566412.htm,钰门国际贸易（上海）有限公司隶属台湾所罗门集团（成立于1973年），于 2002 年独资在上海成立，除了燃气发电及柴油发电外，更致力于成为 3D 机器视觉及工业用 AI 领导品牌，我们的使命是提供机器人眼睛，使它们拥有类似人类的视觉与辨识能力以执行制造业日益复杂的任务，让机器人更加聪明、更容易使用。我们的产品透过先进的 3D 视觉与最新的深度学习技术，提供机器人强大功能，能有效解决以往机器人做不到...,,
机器学习工程师 －computational　imaging（ 居家办公）联合创始人,上海套肯人工智能科技有限责任公司,2.7万-5万,上海,经验不限,本科,20人以下,,人工智能,http://www.zhaopin.com/jobdetail/CCL1478181760J40710533305.htm,职位名称: 机器学习工程师 －computational　imaging（ 居家办公）联合创始人根据AI发展趋势，AGI　五年内必然会实现，superintelligence 十年内必然实现。我们公司专注于superintelligence，目前筹划用agent实现computational　imaging的automatic research。欢迎您成为我们创业团队的核心成员(联合创始人)，与我...,"股票期权,弹性工作",
智能家居销售,上海厚航电子产品设计有限公司,3.5万-5.5万,上海,1-3年,本科,20-99人,民营,物联网,http://www.zhaopin.com/jobdetail/CCL1388104970J40711995308.htm,岗位职责：1、负责公司产品在行业内的营销销售工作2、负责与行业客户中高层决策链建立联系，保持长期的合作关系，确保服务的延续性，挖掘客户需求，完成公司下达的目标3、拓展行业新客户，对所负责行业的老客户进行梳理和需求激发4、深入了解行业客户需求， 根据行业特点及客户需求组织编写行业场景化解决方案5、负责行业市场策略、销售策略、产品策略的制定任职资格： 1、本科及以上学历2、熟悉相关行业客户市场，具备1...,,
软件工程师（前端/后端/AI/测试、接受断档，语言不限）全国多地有岗,外企德科数字技术有限公司,1.5万-3万,上海,经验不限,本科,10000人以上,合资,人力资源服务,http://www.zhaopin.com/jobdetail/CCL1480117890J40721956905.htm,【学历要求】：统招4年制本科，学信网可查，毕业证学位证都在，经验越丰富越好，初中高级开发工程师均有需求【任职要求】1、计算机、软件、通信等相关专业本科及以上学历；。2、热爱编程，基础扎实，熟悉掌握但不限于JAVA/C++/C/JS/Android等编程语言中的一种或数种，有良好的编程习惯；3、具备独立工作能力和解决问题的能力、善于沟通，乐于合作，热衷新技术，善于总结分享，喜欢动手实践； 1、薪资范...,"加班补助,五险一金,免费班车",14薪
线上兼职美工PS居家设计师,泉州市苏亿网络科技有限公司,4千-8千,上海,经验不限,学历不限,20-99人,民营,电子商务,http://www.zhaopin.com/jobdetail/CCL1448715950J40665574811.htm,招线上兼职美工PS设计师 可居家办公接单 证件照，精修，人像，P图，婚纱照，LOGO，平面设计，3D建模等等 工作内容：可远程办公。 负责由上一级客服安排的设计订单。 全是专人谈好，客户付款了的，只需按要求要完成就行。 要求：熟练PS\AI等设计软件，能独立完成图片的设计。 出稿快，不托稿。责任心强。 工作时间：不限 每天早上8点~凌晨12点都有订单 无限制时间上线时间，自有安排。 快速入职，立即...,,
机器学习工程师 －computational　imaging（ 居家办公）联合创始人,上海套肯人工智能科技有限责任公司,2.7万-5万,上海,经验不限,本科,20人以下,,人工智能,http://www.zhaopin.com/jobdetail/CCL1478181760J40710533305.htm,职位名称: 机器学习工程师 －computational　imaging（ 居家办公）联合创始人根据AI发展趋势，AGI　五年内必然会实现，superintelligence 十年内必然实现。我们公司专注于superintelligence，目前筹划用agent实现computational　imaging的automatic research。欢迎您成为我们创业团队的核心成员(联合创始人)，与我...,"股票期权,弹性工作",
智能家居销售,上海厚航电子产品设计有限公司,3.5万-5.5万,上海,1-3年,本科,20-99人,民营,物联网,http://www.zhaopin.com/jobdetail/CCL1388104970J40711995308.htm,岗位职责：1、负责公司产品在行业内的营销销售工作2、负责与行业客户中高层决策链建立联系，保持长期的合作关系，确保服务的延续性，挖掘客户需求，完成公司下达的目标3、拓展行业新客户，对所负责行业的老客户进行梳理和需求激发4、深入了解行业客户需求， 根据行业特点及客户需求组织编写行业场景化解决方案5、负责行业市场策略、销售策略、产品策略的制定任职资格： 1、本科及以上学历2、熟悉相关行业客户市场，具备1...,,
AI产品架构师,金桥信息,2.5万-3万,上海,3-5年,本科,500-999人,上市公司,互联网,http://www.zhaopin.com/jobdetail/CC120347960J40677255911.htm,工作职责1. 参与AI业务产品平台的搭建，并负责技术框架的规划和架构设计，并推动相关组件选型、模块分解以及系统落地；2. 深入了解业界AI平台的发展趋势，应用AI和大模型技术，保证平台技术架构的先进性和前瞻性；3. 完成技术文档撰写、开发、Code Review等相关技术工作，并解决过程中的核心技术问题，严格保证系统的交付质量。任职要求1. 本科及以上学历，计算机相关专业，5年以上开发经验、3年以...,,
架构师（AI方向）,大连众和众科技有限公司,2万-2.7万,上海,5-10年,本科,100-299人,民营,计算机软件,http://www.zhaopin.com/jobdetail/CC822884050J40854854004.htm,职位概述：我们正在寻找一位具有深厚研究背景和创新思维的AI Researcher & Architect，来引领我们的AI研发团队，推动前沿技术的探索与应用。作为AI Researcher & Architect，你将负责研发新的AI模型，优化现有架构，并指导团队实现高效的解决方案。主要职责：1. 负责研究和开发GenAI相关产品的应用架构。2. 不断迭代产品应用架构底层技术的创新和设计，紧跟技术...,,
兼职PPT设计师支持异地居家办公,河南神笔网络科技有限公司,5千-1万元/月,上海,1年以下,学历不限,100-299人,民营,装饰装修,http://www.zhaopin.com/jobdetail/CCL1468138190J40685637810.htm,"我司在电商平台有自己的设计店铺，工作便利，多渠道订单，不用担心订单问题，主要做详情页、首页、海报、宣传册等，需要大量设计师。公司与各位设计人员双方本着友好合作、平等互利的原则,您做单，我给单，您定稿，我结算，互惠互利，做的越多给予的单量与金额均会优质化。1、可接受应届毕业生2、有良好的服务意识3、有耐心，可以和客户良好的沟通并设计出成稿。经常联系不上的勿扰玻璃心的勿扰和客户沟通一点困难就退缩的勿扰...",,
AI产品SEO负责人,上海克而瑞信息技术有限公司,2.5万-3万,上海,3-5年,本科,1000-9999人,外商独资,互联网,http://www.zhaopin.com/jobdetail/CC867077430J40725876505.htm,岗位要求：1.SEO策略制定与执行：根据公司AI产品的市场定位，制定整体SEO优化策略和计划。监控并分析SEO效果，持续优化网站结构、内容和关键词布局。 2.关键词研究与分析：进行市场和竞争对手分析，挖掘高价值关键词。定期更新关键词库，优化内容以提升搜索引擎排名。 3.内容优化与管理：协助内容团队创作符合SEO标准的高质量内容。优化现有网站内容，确保内容的原创性、相关性和可读性。 4.技术SEO：...,,
ai绘图师,上海霖渊文化工作室(个人独资),1万-2万,上海,1-3年,本科,20人以下,其它,互联网,http://www.zhaopin.com/jobdetail/CCL1484389630J40586579305.htm,**招聘职位：AI绘画师（动画/动态漫方向）****岗位职责：**1. 负责动画或动态漫项目中的AI绘画工作，参与项目的创意设计与执行。2. 利用MidJourney和Stable Diffusion等AI工具进行高质量的插画和设计。3. 与团队合作，进行分镜设计，确保视觉效果和剧情的紧密结合。4. 紧跟最新的技术潮流，持续提升工作中的技术应用水平。5. 根据项目需求，进行创新研究和技术探索，优化...,,
AI销售经理-智算（上海）(J12526),曙光信息产业（北京）有限公司,1.5万-3万,上海,1-3年,本科,1000-9999人,国企,计算机硬件,http://www.zhaopin.com/jobdetail/CC120205180J40641619213.htm,工作职责1、负责人工智能机时产品的销售工作，完成年度销售指标；2、拓展新客户，维护现有客户资源，建立良好的客户关系；3、实时把握、深入分析客户需求，及时跟进客户项目进展，提供专业化的解决方案，为客户提供及时有效的服务和支持；4、及时了解、收集市场竞争对手信息，根据市场变化及需求，分析并调整销售策略，确保销售目标的完成；5、参与产品方案的制定和完善，提供市场需求反馈及时调整产品方案。任职资格1、本科...,,
AI产品经理,上海克而瑞信息技术有限公司,2.5万-3.5万,上海,3-5年,本科,1000-9999人,外商独资,互联网,http://www.zhaopin.com/jobdetail/CC867077430J40725377805.htm,岗位职责：1.负责AI产品的整体规划和设计，包括需求分析、产品定义、功能设计等。2.与技术团队紧密合作，推动AI产品的研发和落地，确保产品按时高质量上线。 3.深入理解业务需求，将业务问题转化为具体的AI建模问题，设计合理的解决方案。 4.跟踪和分析产品上线后的效果，持续优化产品性能和用户体验。 5.关注AI领域的***和趋势，探索新的应用场景和技术方案。6.与业务团队保持密切沟通，收集用户反馈，...,,
AI话术训练师,上海职鼎网络科技有限公司,8千-1.2万,上海,经验不限,学历不限,20-99人,,人工智能,http://www.zhaopin.com/jobdetail/CC594140780J40700369812.htm,招聘数据标注/AI训练师，感兴趣随时和我联系~,,
【在线】PPT简历制作文员,河南神笔网络科技有限公司,6千-1万,上海,经验不限,中专/中技,100-299人,民营,装饰装修,http://www.zhaopin.com/jobdetail/CCL1468138190J40646492610.htm,【网店】设计师时间自由，地点不限，只要你会办公软件，欢迎加入我们1.不限时间和地点，会基础软件即可2.能对客户认真负责3.热爱PPT、简历设计4.可远程在线办公5.有网店经验优先考虑,,
人工智能AI产品经理（助理）,上海慧铂信息技术有限公司,8千-1万,上海,经验不限,本科,300-499人,民营,IT服务,http://www.zhaopin.com/jobdetail/CCL1473614780J40635576314.htm,任职描述：1、本科或以上学历优先，理科背景优先。2、经验、专业不限，可接受零基础培训。3、具有良好学习能力和团队合作精神。福利待遇：1、完善的薪酬体系，按学历及专业能力定薪；2、五险一金，含交补、话补、加班补助；3、带薪年假、法定节假日等福利。1. 算法工程师当下，市场对算法工程师的需求极为迫切，特别是那些能够驾驭预训练大规模模型的构建与微调技术，将其融入工作，执行深层次研发任务的专业人才。2. ...,"五险一金,交通补助,通讯补助,加班补助,带薪假期,法定节假日",
AI事业部-猎头顾问,苏州博乐企业管理有限公司,8千-1万,上海,1-3年,本科,20-99人,民营,咨询服务,http://www.zhaopin.com/jobdetail/CC303991510J40640133407.htm,岗位内容：1、根据客户需求，分析职位要求，制定招聘方案，对候选人进行筛选、面试、推荐等；2、协助候选人进行面试辅导、初试并推荐到客户公司，制作推荐报告协调客户公司的面试安排；3、积极了解目标公司的组织架构及部门情况，做好行业垂直的深度积累；4、与客户保持紧密的沟通合作，维护良好的客户关系；5、候选人面试安排及协调；协助顾问跟踪项目进度；收集和发掘市场的相关信息。岗位要求：1、本科及以上学历，5年以...,,
AI训练+客服组长,合肥威寻网络技术有限公司,8千-1.4万,上海,3-5年,本科,500-999人,民营,互联网,http://www.zhaopin.com/jobdetail/CCL1238834220J40665778702.htm,主要职责：1. 客户服务的AB测试执行：根据项目需求，通过企业微信聊天、电话等多种渠道与用户进行沟通参与设计和执行 AB 测试，测试不同的对话策略和话术。2. 优化话术与流程：根据测试结果，持续优化话术和沟通流程，提高转化率和服务质量，并反馈给AI训练模型，及其他客服人员，进行指导和培训，帮助测试结果有效应用。3. 数据收集与分析：收集用户反馈，分析数据，提出改进意见。岗位要求：1. 本科及以上学...,,
